{
  "schemaVersion": 1,
  "projectId": "bijisdk-offline-sample",
  "environment": "development",
  "platform": "editor",
  "configContractVersion": 1,
  "revision": "sample-001",
  "publishedAt": "2026-10-29T10:00:00Z",
  "compatibility": {
    "minAppBuild": 120,
    "maxAppBuild": 120
  },
  "values": {
    "energy": {
      "maximum": 100,
      "refillSeconds": 120
    }
  }
}
